{
  "$schema": "./fhevm-npm/schemas/cleartext-config.schema.json",
  "_readme": [
    "THE source of truth for every value the cleartext stack's languages must agree on.",
    "",
    "Above every generation on purpose. Every face is GENERATED from this file by `fhevm-npm",
    "generate-cleartext-config`: the TypeScript module in `common-vendored/src` (synced into each",
    "generation's `pkg/ts/` by `fhevm-npm sync vendored`), each generation's",
    "`create2-deploy/script/FhevmCleartextConfig.sol`, and each generation's `scripts/cleartext-config.sh`",
    "(sourced by the launchers). This is the one place a value is DECIDED; every copy is a face of it. See",
    "host-contracts-cleartext/RULES.md rule 23.",
    "",
    "Why JSON and not TypeScript. Solidity cannot read a `.ts` module, and neither can a shell script, a",
    "Rust crate, or a CI job that wants a chain id without installing a toolchain. Every language in this",
    "repo can read JSON, and the emitted copies stay checked in — so an operator running `forge script`",
    "against a testnet from an unbuilt checkout is never blocked on a generator having run.",
    "",
    "## The shape of an entry",
    "",
    "  value      the value, as a string in every case — including integers. JSON numbers are IEEE doubles,",
    "             so a uint256 would silently lose precision on the way through a parser; a decimal string",
    "             cannot. Nothing here is fractional: every numeric value is a non-negative integer, and",
    "             there is no floating point anywhere in this file by construction.",
    "  alias      present instead of `value` when the constant is defined as another one. Both faces emit",
    "             the alias, not a repeat, so the two can never drift apart.",
    "  ts         the MINIMAL TypeScript type that holds the value exactly. A face may widen it — a uint",
    "             that fits a `number` also fits a `bigint`, so emitting `100733346448153n` where this says",
    "             `number` is fine. The reverse is not: a value that needs a `bigint` cannot be narrowed to",
    "             a `number` without losing digits, so `bigint` here is a floor and the check enforces it.",
    "  tsEmit     the literal shape the GENERATED TypeScript face emits when it deliberately widens `ts` —",
    "             always `bigint`, widening being the only direction allowed. Defaults to `ts`. Explicit",
    "             because the emitted shape is published API surface: a consumer typed against `bigint`",
    "             breaks if a regeneration silently narrows it.",
    "  solidity   the Solidity type the mirror declares. Also what tells a consumer how to compare the",
    "             value: `address` case-insensitively, `string` exactly, `uint*` numerically.",
    "  formula    for a derived value, the expression it comes from — see below.",
    "  note       why the value is what it is. Required on every entry, and checked.",
    "",
    "## Why a derived value records its formula",
    "",
    "Three of these are keccak-derived, and the string being hashed is the real decision — the hex is only",
    "what it hashes to. Recording only the hex makes the value unverifiable: a mistyped digit looks exactly",
    "like a correct one, survives review, and then every copy of it agrees with every other. The formula is",
    "written in Solidity syntax and is EVALUATED by the check, not merely displayed, so it cannot become a",
    "comment that stopped being true. The preimage is not recorded separately: it is already in the formula,",
    "and a second copy of a value is the thing this whole file exists to prevent.",
    "",
    "## Exactness",
    "",
    "Key order is declaration order, and emitters preserve it. It is load-bearing for `alias` entries, which",
    "must be emitted after the constant they alias.",
    "",
    "Values are copied, never tidied. The mnemonic paths end in `/` because forge's `vm.deriveKey(mnemonic,",
    "path, index)` derives at `{path}{index}` by plain concatenation — a path written `m/44'/60'/0'/2`",
    "silently derives `m/44'/60'/0'/20` for index 0. That is a valid path, a real key and an entirely wrong",
    "signer set, and nothing else in a run notices: the stack deploys, verifies against itself, and fails",
    "only when the js-sdk relayer arrives with keys at the documented path."
  ],

  "appliesTo": {
    "generations": ["v12", "v13"],
    "_note": [
      "The two generations use this set IDENTICALLY — both receive the same generated",
      "`cleartext-config.ts`, synced from `common-vendored/src` — which is why there is no per-generation",
      "section here. That is a fact about today, not a design guarantee. Should a generation ever need a different",
      "value, add an explicit `overrides` block keyed by generation rather than forking a copy: a forked",
      "copy is indistinguishable from drift, which is the entire failure this file exists to end."
    ]
  },

  "constants": {
    "CLEARTEXT_GATEWAY_CHAIN_ID": {
      "value": "100733346448153",
      "ts": "number",
      "tsEmit": "bigint",
      "solidity": "uint256",
      "formula": "uint48(uint256(keccak256(\"fhevm.cheat.chainId cleartext gateway\")))",
      "note": "A cheat-code chain id: chosen by hashing a name so it cannot collide with a real network by accident, and so anyone can reproduce it from the string alone. Truncated to 48 bits because a chain id has to fit where chain ids are stored, and 2^48 is far above any real one while still being nowhere near a plausible typo of one. `ts` is `number` because the value fits a double exactly; the emitted face widens it to `bigint` (`tsEmit`) because a chain id is compared against bigint chain ids everywhere it is used."
    },

    "CLEARTEXT_RELAYER_URL": {
      "value": "https://relayer.cleartext.foo",
      "ts": "string",
      "solidity": "string",
      "note": "Deliberately a `.foo` TLD, which cannot be registered. A cleartext stack has no relayer to talk to, so the URL exists only to be well-formed; pointing it at an unregistrable name means a client that ignores the cleartext path and actually dials it fails to resolve rather than reaching somebody's real host."
    },

    "CLEARTEXT_INPUT_VERIFICATION_ADDRESS": {
      "value": "0x6189F6c0c3E40B4a3c72ec86262295D78d845297",
      "ts": "string",
      "solidity": "address",
      "formula": "address(uint160(uint256(keccak256(\"fhevm.cheat.address cleartext input verification\"))))",
      "note": "Where the gateway's input-verification contract is *said* to live. Nothing is ever deployed there — the address is a name the cleartext path can carry in place of a real one. Hashed rather than picked so it cannot collide with a deployed contract on any chain, and so it is reproducible from the string. Stored EIP-55 checksummed because Solidity REJECTS a hex address literal containing letters unless it is (error 9429), while TypeScript does not care — so the checksummed spelling is the one both faces can use verbatim."
    },

    "CLEARTEXT_DECRYPTION_ADDRESS": {
      "value": "0xEaaA2FC6BC259dF015Aa7Dc8e59e0B67df622721",
      "ts": "string",
      "solidity": "address",
      "formula": "address(uint160(uint256(keccak256(\"fhevm.cheat.address cleartext decryption\"))))",
      "note": "The same idea as the input-verification address, for the gateway's decryption contract: a hashed placeholder, never deployed, reproducible from its preimage, and checksummed for Solidity's sake."
    },

    "CLEARTEXT_COPROCESSOR_COUNT": {
      "value": "4",
      "ts": "number",
      "solidity": "uint256",
      "note": "How many coprocessor signers the stack registers on `InputVerifier`, and therefore how many keys are derived from the coprocessor HD path. Four rather than one because the multi-signer code paths are what a consumer exercises against a real deployment, and a stack with a single signer would let a bug in them pass unnoticed."
    },

    "CLEARTEXT_COPROCESSOR_THRESHOLD": {
      "value": "4",
      "ts": "number",
      "solidity": "uint256",
      "note": "Equal to the count, not a majority. A cleartext stack has no real threshold cryptography whose partial failure it needs to tolerate, so requiring every signer keeps a missing or wrong one a loud failure instead of something the threshold silently absorbs."
    },

    "CLEARTEXT_KMS_NODE_COUNT": {
      "value": "4",
      "ts": "number",
      "solidity": "uint256",
      "note": "How many KMS nodes the stack registers. In v13 it is also the length of every per-node metadata array `ProtocolConfig` stores — signer, tx-sender, IP address, storage URL — and every KMS threshold equals it, for the reason `CLEARTEXT_COPROCESSOR_THRESHOLD` gives."
    },

    "CLEARTEXT_HCU_CAP_PER_BLOCK": {
      "value": "281474976710655",
      "ts": "number",
      "tsEmit": "bigint",
      "solidity": "uint256",
      "formula": "type(uint48).max",
      "note": "Effectively uncapped, and uint48 max specifically because that is the width `HCULimit` stores the figure in — the largest value the field can hold, so the cap can never be the thing a test hits. The cleartext stack does no FHE work, so a real per-block HCU budget would only ever be an artificial limit."
    },

    "CLEARTEXT_MAX_HCU_DEPTH_PER_TX": {
      "value": "5000000",
      "ts": "number",
      "tsEmit": "bigint",
      "solidity": "uint256",
      "note": "Kept at the protocol's real default rather than raised to the uint48 maximum like the per-block cap. Depth bounds how far a single transaction can chain dependent operations, and that limit is one a consumer can legitimately hit in cleartext just as in FHE — so leaving it realistic means a contract that would exceed it on a real stack also fails here, rather than passing and failing later."
    },

    "CLEARTEXT_MAX_HCU_PER_TX": {
      "value": "20000000",
      "ts": "number",
      "tsEmit": "bigint",